{
  "schema_version": "atlas.topology.manifest.v1",
  "source_docs": [
    "docs/LIFELINE_HOSTING_TOPOLOGY.md",
    "docs/LIFELINE_ENV_AND_DOMAIN_CONTRACT.md"
  ],
  "identity": {
    "service_key_template": "{app}/{environment}",
    "stable_public_unit": "app/environment",
    "machine_identity_visibility": "hidden",
    "routing_default": "subdomain-first"
  },
  "apps": [
    {
      "app_id": "fitness",
      "repo_id": "fitness",
      "surface": "product",
      "default_zone": "fawxzzy.com",
      "prod_hostname_mode": "default",
      "preview_hostname_mode": "default",
      "pr_preview_hostname_mode": "default"
    },
    {
      "app_id": "mazer",
      "repo_id": "mazer",
      "surface": "product",
      "default_zone": "fawxzzy.com",
      "prod_hostname_mode": "default",
      "preview_hostname_mode": "default",
      "pr_preview_hostname_mode": "default"
    },
    {
      "app_id": "trove",
      "repo_id": "trove",
      "surface": "product",
      "default_zone": "fawxzzy.com",
      "prod_hostname_mode": "intentional",
      "preview_hostname_mode": "default",
      "pr_preview_hostname_mode": "default",
      "operational_identity": {
        "identity_ref": "stack.yaml#repo_registry.trove.identity",
        "display_name": "FawxzzyWeb",
        "github_repository": "fawxzzy/FawxzzyWeb",
        "provider_project": "fawxzzyweb",
        "provider_project_id": "prj_vhUyajI4AL6BgCF40VnKtdxrBLuV",
        "canonical_public_origin": "https://fawxzzy.com",
        "redirect_origins": [
          "https://www.fawxzzy.com"
        ],
        "accepted_aliases": [
          "Trove",
          "fawxzzy-trove",
          "https://fawxzzy-trove.vercel.app"
        ]
      }
    },
    {
      "app_id": "lifeline",
      "repo_id": "lifeline",
      "surface": "operator",
      "default_zone": "fawxzzy.com",
      "prod_hostname_mode": "intentional",
      "preview_hostname_mode": "none",
      "pr_preview_hostname_mode": "none"
    }
  ],
  "zones": [
    {
      "zone": "fawxzzy.com",
      "kind": "primary-public",
      "status": "active"
    }
  ],
  "environments": {
    "named": [
      {
        "name": "dev",
        "kind": "local",
        "public_hostname_mode": "none"
      },
      {
        "name": "preview",
        "kind": "shared-preview",
        "public_hostname_mode": "default"
      },
      {
        "name": "prod",
        "kind": "production",
        "public_hostname_mode": "default"
      }
    ],
    "ephemeral": [
      {
        "kind": "pr",
        "environment_template": "pr-{number}",
        "match": "^pr-[1-9][0-9]*$",
        "public_hostname_mode": "default"
      }
    ]
  },
  "hostname_rules": [
    {
      "rule_id": "prod",
      "kind": "named",
      "environment": "prod",
      "hostname_template": "{app}.{zone}",
      "service_key_template": "{app}/prod",
      "default_hostname_mode": "default"
    },
    {
      "rule_id": "preview",
      "kind": "named",
      "environment": "preview",
      "hostname_template": "preview-{app}.{zone}",
      "service_key_template": "{app}/preview",
      "default_hostname_mode": "default"
    },
    {
      "rule_id": "pr-preview",
      "kind": "ephemeral",
      "environment_template": "pr-{number}",
      "hostname_template": "pr-{number}.{app}.{zone}",
      "service_key_template": "{app}/pr-{number}",
      "default_hostname_mode": "default"
    },
    {
      "rule_id": "trove-prod",
      "kind": "named",
      "environment": "prod",
      "app_id": "trove",
      "hostname_template": "{zone}",
      "service_key_template": "trove/prod",
      "default_hostname_mode": "intentional"
    },
    {
      "rule_id": "lifeline-prod",
      "kind": "named",
      "environment": "prod",
      "app_id": "lifeline",
      "hostname_template": "lifeline.{zone}",
      "service_key_template": "lifeline/prod",
      "default_hostname_mode": "intentional"
    }
  ],
  "routing": {
    "default_strategy": "subdomain-first",
    "path_routing_default": "disallowed-for-distinct-apps",
    "path_routing_allowed_for": [
      "docs",
      "admin",
      "internal-tools",
      "tightly-coupled-surfaces"
    ],
    "gateway_resolves_service_before_placement": true,
    "tls_termination": "gateway",
    "cookie_boundary": "application-hostname",
    "public_hostname_must_hide": [
      "machine_id",
      "provider_instance_id",
      "placement"
    ]
  },
  "placement": {
    "stable_contract_unit": "app/environment",
    "public_hostname_changes_with_placement": false,
    "default_topology": "shared-gateway-isolated-services",
    "stage_progression": [
      "single-host-many-services",
      "shared-gateway-plus-worker-hosts",
      "lifeline-controlled-multi-host"
    ],
    "lifeline_v1_exclusions": [
      "hosted-control-plane",
      "reverse-proxy-ownership",
      "domain-automation",
      "tls-automation",
      "multi-node-orchestration"
    ]
  }
}
